Date,Search Title,Paper Title,Include (1) Exclude (0),PaperURL,# of Results
5/22/2014,fire AND surrogat* AND invasive*,Forest?fire regimes affect thermoregulatory opportunities for terrestrial ectotherms,0,http://search.ebscohost.com/login.aspx?direct=true&db=agr&AN=IND500652998&site=ehost-live ,1281
5/22/2014,fire AND surrogat* AND invasive*,Genetic Identity and Diversity of Perennial Pepperweed (Lepidium latifolium) in Its Native and Invaded Ranges,0,http://search.ebscohost.com/login.aspx?direct=true&db=agr&AN=IND500673587&site=ehost-live ,1281
5/22/2014,fire AND surrogat* AND invasive*,Geographic range and structure of cryptic genetic diversity among Pacific North American populations of the non-native amphipod Grandidierella japonica ,0,http://search.ebscohost.com/login.aspx?direct=true&db=agr&AN=IND500698797&site=ehost-live ,1281
5/22/2014,fire AND surrogat* AND invasive*,How historic and current wildfire experiences in an Aboriginal community influence mitigation preferences ,0,://search.ebscohost.com/login.aspx?direct=true&db=agr&AN=IND500672421&site=ehost-live ,1281
5/22/2014,fire AND surrogat* AND invasive*,"Increased spatial dominance in high nitrogen, saturated soil due to clonal architecture plasticity of the invasive wetland plant, Phalaris arundinacea ",0,http://search.ebscohost.com/login.aspx?direct=true&db=agr&AN=IND500706447&site=ehost-live ,1281
5/22/2014,fire AND surrogat* AND invasive*,Influence of climate and environment on post-fire recovery of mountain big sagebrush ,0, http://search.ebscohost.com/login.aspx?direct=true&db=agr&AN=IND500726232&site=ehost-live ,1281
5/22/2014,fire AND surrogat* AND invasive*,"Interactions among fire legacies, grazing and topography predict shrub encroachment in post-agricultural p©?ramo ",0,http://search.ebscohost.com/login.aspx?direct=true&db=agr&AN=IND500705386&site=ehost-live ,1281
5/22/2014,fire AND surrogat* AND invasive*,Large airtanker use and outcomes in suppressing wildland fires in the United States,0,http://search.ebscohost.com/login.aspx?direct=true&db=agr&AN=IND500741145&site=ehost-live ,1281
5/22/2014,fire AND surrogat* AND invasive*,Living at the edge of the front; reduced predation risk to invasive round goby in a Great Lakes tributary ,0,http://search.ebscohost.com/login.aspx?direct=true&db=agr&AN=IND500639610&site=ehost-live ,1281
5/22/2014,fire AND surrogat* AND invasive*,Long-term overstory and understory change following logging and fire exclusion in a Sierra Nevada mixed-conifer forest ,0, http://search.ebscohost.com/login.aspx?direct=true&db=agr&AN=IND500708477&site=ehost-live ,1281
5/22/2014,fire AND surrogat* AND invasive*,"Mega-fires, tipping points and ecosystem services: Managing forests and woodlands in an uncertain future ",0, http://search.ebscohost.com/login.aspx?direct=true&db=agr&AN=IND500642341&site=ehost-live ,1281
5/22/2014,fire AND surrogat* AND invasive*,Microbiome diversity of Aphis glycines with extensive superinfection in native and invasive populations,0,http://search.ebscohost.com/login.aspx?direct=true&db=agr&AN=IND500720622&site=ehost-live,1281
5/22/2014,fire AND surrogat* AND invasive*,Natural dispersal mechanisms and dispersal potential of the invasive ascidian Didemnum vexillum ,0,http://search.ebscohost.com/login.aspx?direct=true&db=agr&AN=IND500632582&site=ehost-live ,1281
5/22/2014,fire AND surrogat* AND invasive*,"Pinus strobiformis (southwestern white pine) stand dynamics, regeneration, and disturbance ecology: A review ",0,Post-fire management regimes affect carbon sequestration and storage in a Sierra Nevada mixed conifer forest,1281
5/22/2014,fire AND surrogat* AND invasive*,Post-fire management regimes affect carbon sequestration and storage in a Sierra Nevada mixed conifer forest ,0,http://search.ebscohost.com/login.aspx?direct=true&db=agr&AN=IND500633842&site=ehost-live ,1281
5/22/2014,fire AND surrogat* AND invasive*,Post-fire species recruitment in a semiarid perennial steppe on the Loess Plateau ,0,http://search.ebscohost.com/login.aspx?direct=true&db=agr&AN=IND500617663&site=ehost-live ,1281
5/22/2014,fire AND surrogat* AND invasive*,Potential of hyperspectral imaging and multivariate analysis for rapid and non-invasive detection of gelatin adulteration in prawn ,0, http://search.ebscohost.com/login.aspx?direct=true&db=agr&AN=IND500683068&site=ehost-live ,1281
5/22/2014,fire AND surrogat* AND invasive*,Pre- and post-fire pollutant loads in an urban fringe watershed in Southern California ,0,http://search.ebscohost.com/login.aspx?direct=true&db=agr&AN=IND500703159&site=ehost-live ,1281
5/22/2014,fire AND surrogat* AND invasive*,Projection of fire potential to future climate scenarios in the Alpine area: some methodological considerations ,0,http://search.ebscohost.com/login.aspx?direct=true&db=agr&AN=IND500679172&site=ehost-live ,1281
5/22/2014,fire AND surrogat* AND invasive*,Replacement of native seagrass with invasive algal detritus: impacts to estuarine sediment communities ,0,http://search.ebscohost.com/login.aspx?direct=true&db=agr&AN=IND500612591&site=ehost-live ,1281
5/22/2014,fire AND surrogat* AND invasive*,Response of Six?Lined Racerunner (Aspidoscelis sexlineata) to Habitat Restoration in Fire?Suppressed Longleaf Pine (Pinus palustris) Sandhills ,0,http://search.ebscohost.com/login.aspx?direct=true&db=agr&AN=IND500676432&site=ehost-live ,1281
5/22/2014,fire AND surrogat* AND invasive*,"Safety climate in the US federal wildland fire management community: influences of organisational, environmental, group and individual characteristics ",0,http://search.ebscohost.com/login.aspx?direct=true&db=agr&AN=IND500688492&site=ehost-live ,1281
5/22/2014,fire AND surrogat* AND invasive*,Science and Management of the Introduced Seagrass Zostera japonica in North America ,0,http://search.ebscohost.com/login.aspx?direct=true&db=agr&AN=IND500715480&site=ehost-live ,1281
5/22/2014,fire AND surrogat* AND invasive*,Season of fire and nutrient enrichment affect plant community dynamics in subtropical semi-natural grasslands released from agriculture ,0,http://search.ebscohost.com/login.aspx?direct=true&db=agr&AN=IND500644787&site=ehost-live ,1281
5/22/2014,fire AND surrogat* AND invasive*,Seed abscission schedules and the timing of post-fire salvage of Picea mariana and Pinus banksiana ,0,http://search.ebscohost.com/login.aspx?direct=true&db=agr&AN=IND500673008&site=ehost-live ,1281
5/22/2014,fire AND surrogat* AND invasive*,Selective thinning of Arbutus unedo coppices following fire: Effects on growth at the individual and plot level,0,http://search.ebscohost.com/login.aspx?direct=true&db=agr&AN=IND500627237&site=ehost-live ,1281
5/22/2014,fire AND surrogat* AND invasive*, Small-scale patch structure in North American and South African grasslands responds differently to fire and grazing ,0,http://search.ebscohost.com/login.aspx?direct=true&db=agr&AN=IND500680383&site=ehost-live ,1281
5/22/2014,fire AND surrogat* AND invasive*,Snag longevity and surface fuel accumulation following post-fire logging in a ponderosa pine dominated forest ,0,http://search.ebscohost.com/login.aspx?direct=true&db=agr&AN=IND500602240&site=ehost-live ,1281
5/22/2014,fire AND surrogat* AND invasive*,"Spatial, seasonal, and diel forest floor moisture dynamics in Jeffrey pine-white fir forests of the Lake Tahoe Basin, USA ",0,http://search.ebscohost.com/login.aspx?direct=true&db=agr&AN=IND500683148&site=ehost-live ,1281
5/22/2014,fire AND surrogat* AND invasive*,"Stand development, fire and growth of old-growth and young forests in southwestern Oregon, USA ",0,http://search.ebscohost.com/login.aspx?direct=true&db=agr&AN=IND500633868&site=ehost-live ,1281
5/22/2014,fire AND surrogat* AND invasive*,Stand water use status in relation to fire in a mixed species eucalypt forest ,0,http://search.ebscohost.com/login.aspx?direct=true&db=agr&AN=IND500684442&site=ehost-live ,1281
5/22/2014,fire AND surrogat* AND invasive*,Structure and phylogenetic diversity of post-fire ectomycorrhizal communities of maritime pine ,0,http://search.ebscohost.com/login.aspx?direct=true&db=agr&AN=IND500721889&site=ehost-live ,1281
5/22/2014,fire AND surrogat* AND invasive*,The impact of two non-native plant species on native flora performance: potential implications for habitat restoration ,0,http://search.ebscohost.com/login.aspx?direct=true&db=agr&AN=IND500634869&site=ehost-live ,1281
5/22/2014,fire AND surrogat* AND invasive*,Using Life Strategies to Explore the Vulnerability of Ecosystem Services to Invasion by Alien Plants ,0,http://search.ebscohost.com/login.aspx?direct=true&db=agr&AN=IND500663928&site=ehost-live ,1281
5/22/2014,fire AND surrogat* AND invasive*,Using native annual plants to restore post-fire habitats in western North America ,0,http://search.ebscohost.com/login.aspx?direct=true&db=agr&AN=IND500688480&site=ehost-live ,1281
5/22/2014,fire AND surrogat* AND invasive*,"Variability of warm/dry mixed conifer forests in southwestern Colorado, USA: Implications for ecological restoration ",0,http://search.ebscohost.com/login.aspx?direct=true&db=agr&AN=IND500684444&site=ehost-live ,1281
5/22/2014,fire AND surrogat* AND invasive*,Why are aggregates destroyed in low intensity fire?,0,http://search.ebscohost.com/login.aspx?direct=true&db=agr&AN=IND500616018&site=ehost-live,1281
5/22/2014,fire AND surrogat* AND invasive*,A review of recent advances in risk analysis for wildfire management ,0, http://search.ebscohost.com/login.aspx?direct=true&db=agr&AN=IND500630160&site=ehost-live ,1281
5/22/2014,fire AND surrogat* AND invasive*,"Allee effects, aggregation, and invasion success ",0,http://search.ebscohost.com/login.aspx?direct=true&db=agr&AN=IND500653729&site=ehost-live ,1281
5/22/2014,fire AND surrogat* AND invasive*,An agent-based simulation of extirpation of Ceratitis capitata applied to invasions in California ,0,http://search.ebscohost.com/login.aspx?direct=true&db=agr&AN=IND500730638&site=ehost-live ,1281
5/22/2014,fire AND surrogat* AND invasive*,Arbuscular mycorrhizal fungal community differs between a coexisting native shrub and introduced annual grass ,0, http://search.ebscohost.com/login.aspx?direct=true&db=agr&AN=IND500625309&site=ehost-live ,1281
5/22/2014,fire AND surrogat* AND invasive*,Are Early Summer Wildfires an Opportunity to Revegetate Exotic Grass-Invaded Plant Communities,0,http://search.ebscohost.com/login.aspx?direct=true&db=agr&AN=IND500645565&site=ehost-live ,1281
5/22/2014,fire AND surrogat* AND invasive*,"Arid old-field restoration: Native perennial grasses suppress weedsand erosion, but also suppress native shrubs ",0,http://search.ebscohost.com/login.aspx?direct=true&db=agr&AN=IND500728140&site=ehost-live ,1281
5/22/2014,fire AND surrogat* AND invasive*,Assessing possible shifts in wildfire regimes under a changing climate in mountainous landscapes ,0,http://search.ebscohost.com/login.aspx?direct=true&db=agr&AN=IND500708474&site=ehost-live ,1281
5/22/2014,fire AND surrogat* AND invasive*,Assessing the effect of foliar moisture on the spread rate of crown fires ,0,http://search.ebscohost.com/login.aspx?direct=true&db=agr&AN=IND500672416&site=ehost-live ,1281
5/22/2014,fire AND surrogat* AND invasive*,Bracken fern (Pteridium aquilinum L. kuhn) promotes an open nitrogen cycle in heathland soils ,0,http://search.ebscohost.com/login.aspx?direct=true&db=agr&AN=IND500668085&site=ehost-live ,1281
5/22/2014,fire AND surrogat* AND invasive*,"Canary Grasses (Phalaris, Poaceae): biogeography, molecular dating and the role of floret structure in dispersal ",0, http://search.ebscohost.com/login.aspx?direct=true&db=agr&AN=IND500722912&site=ehost-live ,1281
5/22/2014,fire AND surrogat* AND invasive*,Carbon sequestration of naturally regenerated Aleppo pine stands in response to early thinning ,0,http://search.ebscohost.com/login.aspx?direct=true&db=agr&AN=IND500653591&site=ehost-live ,1281
5/22/2014,fire AND surrogat* AND invasive*,Comparative study of the reproductive biology of two congeneric and introduced goby species: implications for management strategies ,0,http://search.ebscohost.com/login.aspx?direct=true&db=agr&AN=IND500649335&site=ehost-live ,1281
5/22/2014,fire AND surrogat* AND invasive*,Comparison of native and exotic distribution and richness models across scales reveals essential conservation lessons,0,http://search.ebscohost.com/login.aspx?direct=true&db=agr&AN=IND500721480&site=ehost-live ,1281
5/22/2014,fire AND surrogat* AND invasive*,"Cryptic genetic diversity in Rattus of the San Francisco Bay region, California ",0,http://search.ebscohost.com/login.aspx?direct=true&db=agr&AN=IND500638564&site=ehost-live ,1281
5/22/2014,fire AND surrogat* AND invasive*,Delimiting the coastal geographic background to predict potential distribution of Spartina alterniflora ,0,http://search.ebscohost.com/login.aspx?direct=true&db=agr&AN=IND500688309&site=ehost-live ,1281
5/22/2014,fire AND surrogat* AND invasive*,"Differences in leaf nitrogen content, photosynthesis, and resource-use efficiency between Eichhornia crassipes and a native plant Monochoria vaginalis in response to altered sediment nutrient levels ",0,http://search.ebscohost.com/login.aspx?direct=true&db=agr&AN=IND500659468&site=ehost-live ,1281
5/22/2014,fire AND surrogat* AND invasive*,Different arbuscular mycorrhizae and competition with an exotic grass affect the growth of Podocarpus cunninghamii Colenso cuttings ,0,http://search.ebscohost.com/login.aspx?direct=true&db=agr&AN=IND500628283&site=ehost-live ,1281
5/22/2014,fire AND surrogat* AND invasive*,Diversity of secondary endosymbionts among different putative species of the whitefly Bemisia tabaci ,0,http://search.ebscohost.com/login.aspx?direct=true&db=agr&AN=IND500653380&site=ehost-live ,1281
5/22/2014,fire AND surrogat* AND invasive*,Ecology of Compounding Disturbances: The Effects of Prescribed Burning After Clearcutting ,0,http://search.ebscohost.com/login.aspx?direct=true&db=agr&AN=IND500624458&site=ehost-live ,1281
5/22/2014,fire AND surrogat* AND invasive*,Effect of long-term understory prescribed burning on standing and down dead woody material in dry upland oak forests ,0,http://search.ebscohost.com/login.aspx?direct=true&db=agr&AN=IND500633825&site=ehost-live ,1281
5/22/2014,fire AND surrogat* AND invasive*,Effects of climate on emerald ash borer mortality and the potential for ash survival in North America,0,http://search.ebscohost.com/login.aspx?direct=true&db=agr&AN=IND500677977&site=ehost-live ,1281
5/22/2014,fire AND surrogat* AND invasive*,Effects of distribution of bulk density and moisture content on shrub fires ,0,http://search.ebscohost.com/login.aspx?direct=true&db=agr&AN=IND500680891&site=ehost-live ,1281
5/22/2014,fire AND surrogat* AND invasive*,Effects of wildfire on national park visitation and the regional economy: a natural experiment in the Northern Rockies ,0,http://search.ebscohost.com/login.aspx?direct=true&db=agr&AN=IND500710984&site=ehost-live ,1281
5/22/2014,fire AND surrogat* AND invasive*,Environmental Determinants of Emergent Macrophyte Vegetation in Pacific Northwest Estuarine Tidal Wetlands ,0,http://search.ebscohost.com/login.aspx?direct=true&db=agr&AN=IND500637589&site=ehost-live ,1281
5/22/2014,fire AND surrogat* AND invasive*,Established and new technologies reduce increasing pest and pathogen threats to Eucalypt plantations ,0, http://search.ebscohost.com/login.aspx?direct=true&db=agr&AN=IND500665597&site=ehost-live ,1281
5/22/2014,fire AND surrogat* AND invasive*,Establishing Cool?Season Grasses on a Degraded Arid Rangeland of the Colorado Plateau,0, http://search.ebscohost.com/login.aspx?direct=true&db=agr&AN=IND500715812&site=ehost-live ,1281
5/22/2014,fire AND surrogat* AND invasive*,Lonicera species both escape and resist specialist and generalist herbivores in the introduced range in North America ,0,http://search.ebscohost.com/login.aspx?direct=true&db=agr&AN=IND500675809&site=ehost-live ,1281
5/22/2014,fire AND surrogat* AND invasive*,Forest recovery of areas deforested by fire increases with elevation in the tropical Andes ,0,http://search.ebscohost.com/login.aspx?direct=true&db=agr&AN=IND500650716&site=ehost-live ,1281
5/22/2014,fire AND surrogat* AND invasive*,Grassland connectivity by motor vehicles and grazing livestock ,0,http://search.ebscohost.com/login.aspx?direct=true&db=agr&AN=IND500696123&site=ehost-live ,1281
5/22/2014,fire AND surrogat* AND invasive*,Historical Land-Use Influences the Long-Term Stream Turbidity Response to a Wildfire ,0,http://search.ebscohost.com/login.aspx?direct=true&db=agr&AN=IND500720669&site=ehost-live ,1281
5/22/2014,fire AND surrogat* AND invasive*,Hydrochory and water induced germination enhance invasion of Fraxinus pennsylvanica ,0,http://search.ebscohost.com/login.aspx?direct=true&db=agr&AN=IND500684472&site=ehost-live ,1281
5/22/2014,fire AND surrogat* AND invasive*,Impacts of the emerald ash borer (Agrilus planipennis Fairmaire) induced ash (Fraxinus spp.) mortality on forest carbon cycling and successional dynamics in the eastern United States,0,http://search.ebscohost.com/login.aspx?direct=true&db=agr&AN=IND500638580&site=ehost-live ,1281
5/22/2014,fire AND surrogat* AND invasive*,Innovative snow harvesting technology increases vegetation establishment success in native sagebrush ecosystem restoration ,0,http://search.ebscohost.com/login.aspx?direct=true&db=agr&AN=IND500707890&site=ehost-live ,1281
5/22/2014,fire AND surrogat* AND invasive*,"Integrating Management Techniques to Restore Sites Invaded by Mile?a?Minute Weed, Persicaria perfoliata ",0,http://search.ebscohost.com/login.aspx?direct=true&db=agr&AN=IND500737818&site=ehost-live ,1281
5/22/2014,fire AND surrogat* AND invasive*,"LANDFIRE – A national vegetation/fuels data base for use in fuels treatment, restoration, and suppression planning ",0,http://search.ebscohost.com/login.aspx?direct=true&db=agr&AN=IND500642336&site=ehost-live ,1281
5/22/2014,fire AND surrogat* AND invasive*, Multidisciplinary synthesis of long-term human–ecosystem interactions: A perspective from the Garry oak ecosystem of British Columbia,0,http://search.ebscohost.com/login.aspx?direct=true&db=agr&AN=IND500696715&site=ehost-live ,1281
5/22/2014,fire AND surrogat* AND invasive*,Native and non?native grasses generate common types of plant–soil feedbacks by altering soil nutrients and microbial communities ,0,http://search.ebscohost.com/login.aspx?direct=true&db=agr&AN=IND500643518&site=ehost-live ,1281
5/22/2014,fire AND surrogat* AND invasive*,Natural forest floor clearings around trees in Jeffrey pine forests reduce tree damage and mortality following wildfire ,0,http://search.ebscohost.com/login.aspx?direct=true&db=agr&AN=IND500708470&site=ehost-live ,1281
5/22/2014,fire AND surrogat* AND invasive*,Phenotypic diversity of Aegilops cylindrica (jointed goatgrass) accessions from the western United States under irrigated and dryland conditions ,0,http://search.ebscohost.com/login.aspx?direct=true&db=agr&AN=IND500604303&site=ehost-live ,1281
5/22/2014,fire AND surrogat* AND invasive*,Pollination of a threatened orchid by an introduced hawk moth species in the tallgrass prairie of North America ,0,http://search.ebscohost.com/login.aspx?direct=true&db=agr&AN=IND500706519&site=ehost-live ,1281
5/22/2014,fire AND surrogat* AND invasive*,"Polyploidy and invasion of English ivy (Hedera spp., Araliaceae) in North American forests ",0,http://search.ebscohost.com/login.aspx?direct=true&db=agr&AN=IND500694307&site=ehost-live ,1281
5/22/2014,fire AND surrogat* AND invasive*,"Predicting Microstegium vimineum invasion in natural plant communities of the southern Blue Ridge Mountains, USA ",0,http://search.ebscohost.com/login.aspx?direct=true&db=agr&AN=IND500663129&site=ehost-live ,1281
5/22/2014,fire AND surrogat* AND invasive*,Recovery of forest-floor vegetation after a wildfire in a Picea mariana forest ,0,http://search.ebscohost.com/login.aspx?direct=true&db=agr&AN=IND500708890&site=ehost-live,1281
5/22/2014,fire AND surrogat* AND invasive*,Relationships between tree stand density and burn severity as measured by the Composite Burn Index following a ponderosa pine forest wildfire in the American Southwest ,0,http://search.ebscohost.com/login.aspx?direct=true&db=agr&AN=IND500667200&site=ehost-live ,1281
5/22/2014,fire AND surrogat* AND invasive*,"Relationships of surface water, pore water, and sediment chemistry in wetlands adjacent to Great Salt Lake, Utah, and potential impacts on plant community health ",0,http://search.ebscohost.com/login.aspx?direct=true&db=agr&AN=IND500605076&site=ehost-live ,1281
5/22/2014,fire AND surrogat* AND invasive*,Responses to invasion and invader removal differ between native and exotic plant groups in a coastal dune ,0,http://search.ebscohost.com/login.aspx?direct=true&db=agr&AN=IND500709550&site=ehost-live ,1281
5/22/2014,fire AND surrogat* AND invasive*,Restoration and Science: A Practitioner/Scientist's View from Rare Habitat Restoration at a Southern California Preserve ,0, http://search.ebscohost.com/login.aspx?direct=true&db=agr&AN=IND500649711&site=ehost-live ,1281
5/22/2014,fire AND surrogat* AND invasive*,Restoring Perennial Warm?Season Grasses as a Means of Reversing Mesophication of Oak Woodlands in Northern Mississippi ,0,http://search.ebscohost.com/login.aspx?direct=true&db=agr&AN=IND500649713&site=ehost-live ,1281
5/22/2014,fire AND surrogat* AND invasive*,Seeing the forest for the invasives: mapping buckthorn in the Oak Openings ,0,http://search.ebscohost.com/login.aspx?direct=true&db=agr&AN=IND500618251&site=ehost-live ,1281
5/22/2014,fire AND surrogat* AND invasive*,Snag Benchmarks and Treatment Options for?Mixed?Pine Forest Restoration in Eastern Upper Michigan ,0,http://search.ebscohost.com/login.aspx?direct=true&db=agr&AN=IND500689893&site=ehost-live ,1281
5/22/2014,fire AND surrogat* AND invasive*,"Standing variation boosted by multiple sources of introduction contributes to the success of the introduced species, Lotus corniculatus",0,http://search.ebscohost.com/login.aspx?direct=true&db=agr&AN=IND500706866&site=ehost-live,1281
5/22/2014,fire AND surrogat* AND invasive*,The effect of different nutrient concentrations on the growth rate and nitrogen storage of watercress,0,http://search.ebscohost.com/login.aspx?direct=true&db=agr&AN=IND500631070&site=ehost-live ,1281
5/22/2014,fire AND surrogat* AND invasive*,The Influence of Hydromorphological Stressors on Estuarine Vegetation Indicators,0,http://search.ebscohost.com/login.aspx?direct=true&db=agr&AN=IND500685112&site=ehost-live ,1281
5/22/2014,fire AND surrogat* AND invasive*,The invertebrate communities associated with a Chrysanthemum coronarium-invaded coastal sage scrub area in Southern California ,0,http://search.ebscohost.com/login.aspx?direct=true&db=agr&AN=IND500718443&site=ehost-live ,1281
5/22/2014,fire AND surrogat* AND invasive*,The role of facilitation and competition in the development and resilience of aspen forests,0,http://search.ebscohost.com/login.aspx?direct=true&db=agr&AN=IND500667159&site=ehost-live ,1281
5/22/2014,fire AND surrogat* AND invasive*,The Runaway Weed: Costs and Failures of Phragmites australis Management in the USA,0,http://search.ebscohost.com/login.aspx?direct=true&db=agr&AN=IND500659592&site=ehost-live ,1281
5/22/2014,fire AND surrogat* AND invasive*,Threats to Canadian species at risk: An analysis of finalized recovery strategies ,0,http://search.ebscohost.com/login.aspx?direct=true&db=agr&AN=IND500696711&site=ehost-live ,1281
5/22/2014,fire AND surrogat* AND invasive*,Traditional coppice forest management drives the invasion of Ailanthus altissima and Robinia pseudoacacia into deciduous forests ,0,http://search.ebscohost.com/login.aspx?direct=true&db=agr&AN=IND500633847&site=ehost-live ,1281
5/22/2014,fire AND surrogat* AND invasive*,Tree reduction and debris from mastication of Utah juniper alter the soil climate in sagebrush steppe ,0,http://search.ebscohost.com/login.aspx?direct=true&db=agr&AN=IND500708462&site=ehost-live ,1281
5/22/2014,fire AND surrogat* AND invasive*,Unpaved road verges as hotspots of fleshy-fruited shrub recruitment and establishment ,0,http://search.ebscohost.com/login.aspx?direct=true&db=agr&AN=IND500706536&site=ehost-live ,1281
5/22/2014,fire AND surrogat* AND invasive*, Using species spectra to evaluate plant community conservation value along a gradient of anthropogenic disturbance,0,http://search.ebscohost.com/login.aspx?direct=true&db=agr&AN=IND500674806&site=ehost-live ,1281
5/22/2014,fire AND surrogat* AND invasive*,What Lies Beneath? An Evaluation of Rapid Assessment Tools for Management of Hull Fouling,0,http://search.ebscohost.com/login.aspx?direct=true&db=agr&AN=IND500678743&site=ehost-live ,1281
5/22/2014,fire AND surrogat* AND invasive*,A Microbial Link between Elevated CO? and Methane Emissions that is Plant Species-Specific,0,http://search.ebscohost.com/login.aspx?direct=true&db=agr&AN=IND500693566&site=ehost-live ,1281
5/22/2014,fire AND surrogat* AND invasive*,Adaptive responses to directional trait selection in the Miocene enabled Cape proteas to colonize the savanna grasslands ,0,http://search.ebscohost.com/login.aspx?direct=true&db=agr&AN=IND500705336&site=ehost-live ,1281
5/22/2014,fire AND surrogat* AND invasive*,Afforestation opportunities when stand productivity is driven by a high risk of natural disturbance: a review of the open lichen woodland in the eastern boreal forest of Canada ,0,http://search.ebscohost.com/login.aspx?direct=true&db=agr&AN=IND500619416&site=ehost-live ,1281
5/22/2014,fire AND surrogat* AND invasive*, Ameiurus melas (black bullhead): morphological characteristics of new introduced species and its comparison with Ameiurus nebulosus (brown bullhead,0,http://search.ebscohost.com/login.aspx?direct=true&db=agr&AN=IND500632060&site=ehost-live ,1281
