Date,Search Title,Paper Title,Include (1) Exclude (0),PaperURL,# of Results
5/22/2014,fire AND surrogat* AND exotic*,"Early forest dynamics in stand-replacing fire patches in the northern Sierra Nevada, California, USA ",0,http://search.ebscohost.com/login.aspx?direct=true&db=agr&AN=IND500705384&site=ehost-live ,828
5/22/2014,fire AND surrogat* AND exotic*,Ecological effects of alternative fuel-reduction treatments: highlights of the National Fire and Fire Surrogate study ,0,http://search.ebscohost.com/login.aspx?direct=true&db=agr&AN=IND500630164&site=ehost-live ,828
5/22/2014,fire AND surrogat* AND exotic*,Ecological impacts of the invasive grass Sorghum halepense on native tallgrass prairie ,0,http://search.ebscohost.com/login.aspx?direct=true&db=agr&AN=IND500618252&site=ehost-live ,828
5/22/2014,fire AND surrogat* AND exotic*,Ecology of Compounding Disturbances: The Effects of Prescribed Burning After Clearcutting ,0,http://search.ebscohost.com/login.aspx?direct=true&db=agr&AN=IND500624458&site=ehost-live ,828
5/22/2014,fire AND surrogat* AND exotic*,Econometric analysis of fire suppression production functions for large wildland fires ,0,http://search.ebscohost.com/login.aspx?direct=true&db=agr&AN=IND500636180&site=ehost-live ,828
5/22/2014,fire AND surrogat* AND exotic*,Ectomycorrhizal fungal community assembly on regenerating Douglas-fir after wildfire and clearcut harvesting ,0,http://search.ebscohost.com/login.aspx?direct=true&db=agr&AN=IND500680559&site=ehost-live ,828
5/22/2014,fire AND surrogat* AND exotic*,Effect of long-term understory prescribed burning on standing and down dead woody material in dry upland oak forests ,0,http://search.ebscohost.com/login.aspx?direct=true&db=agr&AN=IND500633825&site=ehost-live ,828
5/22/2014,fire AND surrogat* AND exotic*,"Effect of water stress on growth, water use efficiency and gas exchange as related to osmotic adjustment of two halophytes Atriplex spp.",0, http://search.ebscohost.com/login.aspx?direct=true&db=agr&AN=IND500663621&site=ehost-live ,828
5/22/2014,fire AND surrogat* AND exotic*,"Effectiveness of protected areas in the Colombian Andes: deforestation, fire and land-use changes ",0,http://search.ebscohost.com/login.aspx?direct=true&db=agr&AN=IND500642578&site=ehost-live ,828
5/22/2014,fire AND surrogat* AND exotic*,Effects of a prescribed fire on water use and photosynthetic capacity of pitch pines,0,http://search.ebscohost.com/login.aspx?direct=true&db=agr&AN=IND500678816&site=ehost-live ,828
5/22/2014,fire AND surrogat* AND exotic*,Effects of distribution of bulk density and moisture content on shrub fires,0,http://search.ebscohost.com/login.aspx?direct=true&db=agr&AN=IND500680891&site=ehost-live ,828
5/22/2014,fire AND surrogat* AND exotic*,"Effects of Disturbance on Fine Root Dynamics in the Boreal Forests of Northern Ontario, Canada ",0,http://search.ebscohost.com/login.aspx?direct=true&db=agr&AN=IND500652385&site=ehost-live ,828
5/22/2014,fire AND surrogat* AND exotic*,"Effects of fire severity and burn patchiness on hillslope-scale surface runoff, erosion and hydrologic connectivity in a prescribed burn ",0,http://search.ebscohost.com/login.aspx?direct=true&db=agr&AN=IND500708399&site=ehost-live ,828
5/22/2014,fire AND surrogat* AND exotic*,Effects of fire severity on early recovery of Patagonian steppes ,0,http://search.ebscohost.com/login.aspx?direct=true&db=agr&AN=IND500710986&site=ehost-live ,828
5/22/2014,fire AND surrogat* AND exotic*,Effects of prescribed burning and harvesting on ground-dwelling spiders in the Canadian boreal mixedwood forest ,0,http://search.ebscohost.com/login.aspx?direct=true&db=agr&AN=IND500668201&site=ehost-live ,828
5/22/2014,fire AND surrogat* AND exotic*,Effects of wildfire on national park visitation and the regional economy: a natural experiment in the Northern Rockies ,0,http://search.ebscohost.com/login.aspx?direct=true&db=agr&AN=IND500710984&site=ehost-live ,828
5/22/2014,fire AND surrogat* AND exotic*,Elevated carbon dioxide and fire reduce biomass of native grass species when grown in competition with invasive exotic grasses in a savanna experimental system ,0, http://search.ebscohost.com/login.aspx?direct=true&db=agr&AN=IND500718433&site=ehost-live ,828
5/22/2014,fire AND surrogat* AND exotic*,Estimating the time since fire of long-unburnt Eucalyptus salubris (Myrtaceae) stands in the Great Western Woodlands ,0,http://search.ebscohost.com/login.aspx?direct=true&db=agr&AN=IND500617665&site=ehost-live ,828
5/22/2014,fire AND surrogat* AND exotic*,Estimating US federal wildland fire managers’ preferences toward competing strategic suppression objectives,0,http://search.ebscohost.com/login.aspx?direct=true&db=agr&AN=IND500636178&site=ehost-live ,828
5/22/2014,fire AND surrogat* AND exotic*,Evaluating hill prairie quality in the Midwestern United States using Auchenorrhyncha (Insecta: Hemiptera) and vascular plants: a case study in implementing grassland conservation planning and management ,0, http://search.ebscohost.com/login.aspx?direct=true&db=agr&AN=IND500634778&site=ehost-live ,828
5/22/2014,fire AND surrogat* AND exotic*,"Evaluating spectral indices and spectral mixture analysis for assessing fire severity, combustion completeness and carbon emissions ",0,http://search.ebscohost.com/login.aspx?direct=true&db=agr&AN=IND500680897&site=ehost-live ,828
5/22/2014,fire AND surrogat* AND exotic*,Evidence for the effect of homes on wildfire suppression costs ,0,http://search.ebscohost.com/login.aspx?direct=true&db=agr&AN=IND500672414&site=ehost-live ,828
5/22/2014,fire AND surrogat* AND exotic*,Examining the knowing–doing gap in the conservation of a fire-dependent ecosystem ,0,http://search.ebscohost.com/login.aspx?direct=true&db=agr&AN=IND500644772&site=ehost-live ,828
5/22/2014,fire AND surrogat* AND exotic*," Exotic annual grass alters fuel amounts, continuity and moisture content",0,http://search.ebscohost.com/login.aspx?direct=true&db=agr&AN=IND500663584&site=ehost-live ,828
5/22/2014,fire AND surrogat* AND exotic*, Exotic cheatgrass and loss of soil biota decrease the performance of a native grass ,0,http://search.ebscohost.com/login.aspx?direct=true&db=agr&AN=IND500698804&site=ehost-live ,828
5/22/2014,fire AND surrogat* AND exotic*,Exotic species display greater germination plasticity and higher germination rates than native species across multiple cues ,0,://search.ebscohost.com/login.aspx?direct=true&db=agr&AN=IND500694309&site=ehost-live ,828
5/22/2014,fire AND surrogat* AND exotic*,Experimental studies on Vaccinium myrtillus and Vaccinium vitis-idaea in relation to air pollution and global change at northern high latitudes: A review ,0,http://search.ebscohost.com/login.aspx?direct=true&db=agr&AN=IND500605464&site=ehost-live ,828
5/22/2014,fire AND surrogat* AND exotic*,Exploring the onset of high-impact mega-fires through a forest land management prism ,0,http://search.ebscohost.com/login.aspx?direct=true&db=agr&AN=IND500642343&site=ehost-live ,828
5/22/2014,fire AND surrogat* AND exotic*,"Extreme value analysis of forest fires from New York to Nova Scotia, 1950–2010 ",0,http://search.ebscohost.com/login.aspx?direct=true&db=agr&AN=IND500642330&site=ehost-live ,828
5/22/2014,fire AND surrogat* AND exotic*,Factors influencing northern spruce engraver colonization of white spruce slash in interior Alaska ,0,http://search.ebscohost.com/login.aspx?direct=true&db=agr&AN=IND500605291&site=ehost-live ,828
5/22/2014,fire AND surrogat* AND exotic*,Fine-scale genetic structure of Nothofagus pumilio (lenga) at contrasting elevations of the altitudinal gradient ,0,http://search.ebscohost.com/login.aspx?direct=true&db=agr&AN=IND500644663&site=ehost-live ,828
5/22/2014,fire AND surrogat* AND exotic*,Fine-scale variation in surface fire environment and legume germination in the longleaf pine ecosystem ,0, http://search.ebscohost.com/login.aspx?direct=true&db=agr&AN=IND500708436&site=ehost-live ,828
5/22/2014,fire AND surrogat* AND exotic*,"Fire and invasive species: Modifications in the germination potential of Acacia melanoxylon, Conyza canadensis and Eucalyptus globulus ",0,http://search.ebscohost.com/login.aspx?direct=true&db=agr&AN=IND500667199&site=ehost-live ,828
5/22/2014,fire AND surrogat* AND exotic*,"Fire history and forest structure of an endangered subtropical ecosystem in the Florida Keys, USA ",0,http://search.ebscohost.com/login.aspx?direct=true&db=agr&AN=IND500663592&site=ehost-live ,828
5/22/2014,fire AND surrogat* AND exotic*,Fire in managed forests of eastern Canada: Risks and options ,0,http://search.ebscohost.com/login.aspx?direct=true&db=agr&AN=IND500642340&site=ehost-live ,828
5/22/2014,fire AND surrogat* AND exotic*,Fire promotes downy brome (Bromus tectorum L.) seed dispersal ,0,http://search.ebscohost.com/login.aspx?direct=true&db=agr&AN=IND500646691&site=ehost-live ,828
5/22/2014,fire AND surrogat* AND exotic*,Fire regime shift linked to increased forest density in a pi©?on–juniper savanna landscape ,0,http://search.ebscohost.com/login.aspx?direct=true&db=agr&AN=IND500741146&site=ehost-live ,828
5/22/2014,fire AND surrogat* AND exotic*,"Fire, Defoliation, and Competing Species Alter Aristida purpurea Biomass, Tiller, and Axillary Bud Production ",0,http://search.ebscohost.com/login.aspx?direct=true&db=agr&AN=IND500670196&site=ehost-live ,828
5/22/2014,fire AND surrogat* AND exotic*,Firebrand characteristics of the stringy bark of messmate (Eucalyptus obliqua) investigated using non-tethered samples ,0,http://search.ebscohost.com/login.aspx?direct=true&db=agr&AN=IND500680896&site=ehost-live ,828
5/22/2014,fire AND surrogat* AND exotic*,Fire?induced population reduction and landscape opening increases gene flow via pollen dispersal in Pinus halepensis ,0,http://search.ebscohost.com/login.aspx?direct=true&db=agr&AN=IND500722913&site=ehost-live ,828
5/22/2014,fire AND surrogat* AND exotic*,Forest recovery of areas deforested by fire increases with elevation in the tropical Andes ,0,http://search.ebscohost.com/login.aspx?direct=true&db=agr&AN=IND500650716&site=ehost-live ,828
5/22/2014,fire AND surrogat* AND exotic*,"Forest resilience, climate change, and opportunities for adaptation: A specific case of a general problem ",0,http://search.ebscohost.com/login.aspx?direct=true&db=agr&AN=IND500692210&site=ehost-live ,828
5/22/2014,fire AND surrogat* AND exotic*,Forest?fire regimes affect thermoregulatory opportunities for terrestrial ectotherms ,0,http://search.ebscohost.com/login.aspx?direct=true&db=agr&AN=IND500652998&site=ehost-live ,828
5/22/2014,fire AND surrogat* AND exotic*,Fuel mass and forest structure following stand-replacement fire and post-fire logging in a mixed-evergreen forest,0,http://search.ebscohost.com/login.aspx?direct=true&db=agr&AN=IND500680895&site=ehost-live ,828
5/22/2014,fire AND surrogat* AND exotic*,"Fuel treatment effects on soil chemistry and foliar physiology of three coniferous species at the Teakettle Experimental Forest, California, USA",0,http://search.ebscohost.com/login.aspx?direct=true&db=agr&AN=IND500678815&site=ehost-live ,828
5/22/2014,fire AND surrogat* AND exotic*,Future U.S. wildfire potential trends projected using a dynamically downscaled climate change scenario ,0,http://search.ebscohost.com/login.aspx?direct=true&db=agr&AN=IND500642328&site=ehost-live ,828
5/22/2014,fire AND surrogat* AND exotic*,Genetic resilience in a historically profited root sprouting oak (Quercus pyrenaica Willd.) at its southern boundary ,0,http://search.ebscohost.com/login.aspx?direct=true&db=agr&AN=IND500693050&site=ehost-live ,828
5/22/2014,fire AND surrogat* AND exotic*,Global wildland fire season severity in the 21st century ,0,http://search.ebscohost.com/login.aspx?direct=true&db=agr&AN=IND500642345&site=ehost-live ,828
5/22/2014,fire AND surrogat* AND exotic*,Ground and satellite-based assessments of wet eucalypt forest survival and regeneration for predicting long-term hydrological responses to a large wildfire,0,http://search.ebscohost.com/login.aspx?direct=true&db=agr&AN=IND500642335&site=ehost-live ,828
5/22/2014,fire AND surrogat* AND exotic*,"Hemlock woolly adelgid in the southern Appalachians: Control strategies, ecological impacts, and potential management responses ",0, http://search.ebscohost.com/login.aspx?direct=true&db=agr&AN=IND500633836&site=ehost-live ,828
5/22/2014,fire AND surrogat* AND exotic*,Herbivory and drought interact to enhance spatial patterning and diversity in a savanna understory ,0,http://search.ebscohost.com/login.aspx?direct=true&db=agr&AN=IND500695514&site=ehost-live ,828
5/22/2014,fire AND surrogat* AND exotic*,Historical fire–climate relationships of upper elevation fire regimes in the south-western United States ,0,http://search.ebscohost.com/login.aspx?direct=true&db=agr&AN=IND500680892&site=ehost-live ,828
5/22/2014,fire AND surrogat* AND exotic*,Historical Land-Use Influences the Long-Term Stream Turbidity Response to a Wildfire,0,http://search.ebscohost.com/login.aspx?direct=true&db=agr&AN=IND500720669&site=ehost-live ,828
5/22/2014,fire AND surrogat* AND exotic*,Historical structure and composition of ponderosa pine and mixed-conifer forests in south-central Oregon ,0,http://search.ebscohost.com/login.aspx?direct=true&db=agr&AN=IND500684479&site=ehost-live ,828
5/22/2014,fire AND surrogat* AND exotic*,How does the invasive/native nature of species influence tadpoles’ plastic responses to predators?,0,http://search.ebscohost.com/login.aspx?direct=true&db=agr&AN=IND500643509&site=ehost-live ,828
5/22/2014,fire AND surrogat* AND exotic*,Human-induced edges alter grassland community composition ,0,http://search.ebscohost.com/login.aspx?direct=true&db=agr&AN=IND500644805&site=ehost-live ,828
5/22/2014,fire AND surrogat* AND exotic*,Hymenopteran parasitoids attacking the invasive emerald ash borer (Coleoptera: Buprestidae) in western and central Pennsylvania ,0,http://search.ebscohost.com/login.aspx?direct=true&db=agr&AN=IND500704115&site=ehost-live ,828
5/22/2014,fire AND surrogat* AND exotic*,"Impacts of long-term snow climate change on a high-elevation cold desert shrubland, California, USA ",0,http://search.ebscohost.com/login.aspx?direct=true&db=agr&AN=IND500629924&site=ehost-live ,828
5/22/2014,fire AND surrogat* AND exotic*,Influence of climate and environment on post-fire recovery of mountain big sagebrush,0,http://search.ebscohost.com/login.aspx?direct=true&db=agr&AN=IND500726232&site=ehost-live ,828
5/22/2014,fire AND surrogat* AND exotic*,Influence of Disturbance on Temperate Forest Productivity ,0,http://search.ebscohost.com/login.aspx?direct=true&db=agr&AN=IND500624453&site=ehost-live ,828
5/22/2014,fire AND surrogat* AND exotic*,"Influence of short-interval fire occurrence on post-fire recovery of fire-prone shrublands in California, USA ",0,http://search.ebscohost.com/login.aspx?direct=true&db=agr&AN=IND500636173&site=ehost-live ,828
5/22/2014,fire AND surrogat* AND exotic*,"Integrating Management Techniques to Restore Sites Invaded by Mile?a?Minute Weed, Persicaria perfoliata ",0,http://search.ebscohost.com/login.aspx?direct=true&db=agr&AN=IND500737818&site=ehost-live ,828
5/22/2014,fire AND surrogat* AND exotic*,Interacting effects of wildfire severity and liming on nutrient cycling in a southern Appalachian wilderness area ,0,http://search.ebscohost.com/login.aspx?direct=true&db=agr&AN=IND500653856&site=ehost-live ,828
5/22/2014,fire AND surrogat* AND exotic*," Interactions among fire legacies, grazing and topography predict shrub encroachment in post-agricultural p©?ramo",0,http://search.ebscohost.com/login.aspx?direct=true&db=agr&AN=IND500705386&site=ehost-live ,828
5/22/2014,fire AND surrogat* AND exotic*,"Interactive Effects of Fire, Rainfall, and Litter Quality on Decomposition in Savannas: Frequent Fire Leads to Contrasting Effects ",0,http://search.ebscohost.com/login.aspx?direct=true&db=agr&AN=IND500678569&site=ehost-live ,828
5/22/2014,fire AND surrogat* AND exotic*,"Invasion of Calluna heath by native and non-native conifers: the role of succession, disturbance and allelopathy ",0,http://search.ebscohost.com/login.aspx?direct=true&db=agr&AN=IND500674932&site=ehost-live ,828
5/22/2014,fire AND surrogat* AND exotic*,"Invasive potential of Eucalyptus globulus: Seed dispersal, seedling recruitment and survival in habitats surrounding plantations ",0,http://search.ebscohost.com/login.aspx?direct=true&db=agr&AN=IND500683151&site=ehost-live ,828
5/22/2014,fire AND surrogat* AND exotic*,Is burn severity related to fire intensity? Observations from landscape scale remote sensing ,0,http://search.ebscohost.com/login.aspx?direct=true&db=agr&AN=IND500701200&site=ehost-live ,828
5/22/2014,fire AND surrogat* AND exotic*,"Is fire severity increasing in the Sierra Nevada, California, USA?",0, http://search.ebscohost.com/login.aspx?direct=true&db=agr&AN=IND500726233&site=ehost-live ,828
5/22/2014,fire AND surrogat* AND exotic*,Landscape-scale effects of fire severity on mixed-conifer and red fir forest structure in Yosemite National Park ,0,http://search.ebscohost.com/login.aspx?direct=true&db=agr&AN=IND500602245&site=ehost-live ,828
5/22/2014,fire AND surrogat* AND exotic*,Large airtanker use and outcomes in suppressing wildland fires in the United States ,0,http://search.ebscohost.com/login.aspx?direct=true&db=agr&AN=IND500741145&site=ehost-live,828
5/22/2014,fire AND surrogat* AND exotic*," Large-scale weather types, forest fire danger, and wildfire occurrence in the Alps ",0,http://search.ebscohost.com/login.aspx?direct=true&db=agr&AN=IND500602397&site=ehost-live ,828
5/22/2014,fire AND surrogat* AND exotic*,Lightning and fire weather in eastern coastal fynbos shrublands: seasonality and long-term trends ,0,http://search.ebscohost.com/login.aspx?direct=true&db=agr&AN=IND500663586&site=ehost-live ,828
5/22/2014,fire AND surrogat* AND exotic*,Long-term aspen cover change in the western US,0,http://search.ebscohost.com/login.aspx?direct=true&db=agr&AN=IND500667154&site=ehost-live ,828
5/22/2014,fire AND surrogat* AND exotic*,Long-term effects of chaining treatments on vegetation structure in pi©?on–juniper woodlands of the Colorado Plateau ,0,http://search.ebscohost.com/login.aspx?direct=true&db=agr&AN=IND500683150&site=ehost-live ,828
5/22/2014,fire AND surrogat* AND exotic*,Long-term overstory and understory change following logging and fire exclusion in a Sierra Nevada mixed-conifer forest ,0,http://search.ebscohost.com/login.aspx?direct=true&db=agr&AN=IND500708477&site=ehost-live ,828
5/22/2014,fire AND surrogat* AND exotic*,Loss of a foundation forest species due to an exotic invader impacts terrestrial arthropod communities ,0,http://search.ebscohost.com/login.aspx?direct=true&db=agr&AN=IND500650699&site=ehost-live ,828
5/22/2014,fire AND surrogat* AND exotic*,"Managing multiple species or communities? Considering variation in plant species abundances in response to fire interval, frequency and time since fire in a heathy Eucalyptus woodland ",0,http://search.ebscohost.com/login.aspx?direct=true&db=agr&AN=IND500605272&site=ehost-live ,828
5/22/2014,fire AND surrogat* AND exotic*, Manipulating livestock grazing to enhance native plant diversity and cover in native grasslands ,0,http://search.ebscohost.com/login.aspx?direct=true&db=agr&AN=IND500627142&site=ehost-live ,828
5/22/2014,fire AND surrogat* AND exotic*,Mapping wildfire evacuation vulnerability in the western US: the limits of infrastructure ,0,http://search.ebscohost.com/login.aspx?direct=true&db=agr&AN=IND500646701&site=ehost-live ,828
5/22/2014,fire AND surrogat* AND exotic*,Measuring forest structure along productivity gradients in the Canadian boreal with small-footprint Lidar,0,http://search.ebscohost.com/login.aspx?direct=true&db=agr&AN=IND500674837&site=ehost-live ,828
5/22/2014,fire AND surrogat* AND exotic*,"Mega-fires, tipping points and ecosystem services: Managing forests and woodlands in an uncertain future ",0,http://search.ebscohost.com/login.aspx?direct=true&db=agr&AN=IND500642341&site=ehost-live ,828
5/22/2014,fire AND surrogat* AND exotic*,Microsatellite polymorphism in Jatropha curcas L.—A biodiesel plant,0,http://search.ebscohost.com/login.aspx?direct=true&db=agr&AN=IND500687293&site=ehost-live ,828
5/22/2014,fire AND surrogat* AND exotic*,Modeling hazardous fire potential within a completed fuel treatment network in the northern Sierra Nevada ,0,http://search.ebscohost.com/login.aspx?direct=true&db=agr&AN=IND500708391&site=ehost-live ,828
5/22/2014,fire AND surrogat* AND exotic*,Modeling population growth and site specific control of the invasive Lantana camara L. (Verbenaceae) under differing fire regimes ,0,http://search.ebscohost.com/login.aspx?direct=true&db=agr&AN=IND500647429&site=ehost-live ,828
5/22/2014,fire AND surrogat* AND exotic*,Modelling conditional burn probability patterns for large wildland fires ,0,http://search.ebscohost.com/login.aspx?direct=true&db=agr&AN=IND500680889&site=ehost-live ,828
5/22/2014,fire AND surrogat* AND exotic*,Moderate land use shifts plant diversity from overstory to understory and contributes to biotic homogenization in a seasonally dry tropical ecosystem ,0,http://search.ebscohost.com/login.aspx?direct=true&db=agr&AN=IND500644798&site=ehost-live ,828
5/22/2014,fire AND surrogat* AND exotic*,Multi-century changes in vegetation structure and fuel availability in fire-sensitive eucalypt woodlands ,0,http://search.ebscohost.com/login.aspx?direct=true&db=agr&AN=IND500708381&site=ehost-live ,828
5/22/2014,fire AND surrogat* AND exotic*,Multidisciplinary synthesis of long-term human–ecosystem interactions: A perspective from the Garry oak ecosystem of British Columbia ,0,http://search.ebscohost.com/login.aspx?direct=true&db=agr&AN=IND500696715&site=ehost-live ,828
5/22/2014,fire AND surrogat* AND exotic*,Mycorrhizal colonization of Palafoxia feayi (Asteraceae) in a pyrogenic ecosystem ,0,http://search.ebscohost.com/login.aspx?direct=true&db=agr&AN=IND500640208&site=ehost-live ,828
5/22/2014,fire AND surrogat* AND exotic*,Native ungulates of diverse body sizes collectively regulate a long-term woody plant demography and structure of a semi-arid savanna ,0,http://search.ebscohost.com/login.aspx?direct=true&db=agr&AN=IND500733886&site=ehost-live ,828
5/22/2014,fire AND surrogat* AND exotic*,Native–Exotic Species Richness Relationships Across Spatial Scales in a Prairie Restoration Matrix,0, http://search.ebscohost.com/login.aspx?direct=true&db=agr&AN=IND500737808&site=ehost-live ,828
5/22/2014,fire AND surrogat* AND exotic*,Objective and perceived wildfire risk and its influence on private forest landowners’ fuel reduction activities in Oregon’s (USA) ponderosa pine ecoregion ,0,http://search.ebscohost.com/login.aspx?direct=true&db=agr&AN=IND500726225&site=ehost-live ,828
5/22/2014,fire AND surrogat* AND exotic*,On the need for a theory of wildland fire spread ,0,http://search.ebscohost.com/login.aspx?direct=true&db=agr&AN=IND500630163&site=ehost-live ,828
5/22/2014,fire AND surrogat* AND exotic*,On the projection of future fire danger conditions with various instantaneous/mean-daily data sources ,0,http://search.ebscohost.com/login.aspx?direct=true&db=agr&AN=IND500666529&site=ehost-live ,828
5/22/2014,fire AND surrogat* AND exotic*,Origins and distribution of invasive Rubus fruticosus L. agg. (Rosaceae) clones in the Western United States ,0,http://search.ebscohost.com/login.aspx?direct=true&db=agr&AN=IND500663136&site=ehost-live ,828
5/22/2014,fire AND surrogat* AND exotic*,Patch identity and the spatial heterogeneity of woody encroachment in exotic-dominated old-field grasslands ,0,http://search.ebscohost.com/login.aspx?direct=true&db=agr&AN=IND500629925&site=ehost-live ,828
5/22/2014,fire AND surrogat* AND exotic*, Patterns of seed bank and size asymmetry of plant growth across varying sites in the invasive Lantana camara L. (Verbenaceae,0,http://search.ebscohost.com/login.aspx?direct=true&db=agr&AN=IND500665011&site=ehost-live ,828
5/22/2014,fire AND surrogat* AND exotic*,"Perceptions of Wildfire and Landscape Change in the Kenai Peninsula, Alaska ",0,http://search.ebscohost.com/login.aspx?direct=true&db=agr&AN=IND500694238&site=ehost-live ,828
5/22/2014,fire AND surrogat* AND exotic*,Perspectives on Disconnects Between Scientific Information and Management Decisions on Post-fire Recovery in Western US ,0,http://search.ebscohost.com/login.aspx?direct=true&db=agr&AN=IND500707036&site=ehost-live ,828
5/22/2014,fire AND surrogat* AND exotic*,Phenotypic diversity of Aegilops cylindrica (jointed goatgrass) accessions from the western United States under irrigated and dryland conditions ,0,http://search.ebscohost.com/login.aspx?direct=true&db=agr&AN=IND500604303&site=ehost-live ,828
5/22/2014,fire AND surrogat* AND exotic*,Phenotypic plasticity of reproductive traits in response to food availability in invasive and native species of nematode ,0,http://search.ebscohost.com/login.aspx?direct=true&db=agr&AN=IND500670789&site=ehost-live ,828
5/22/2014,fire AND surrogat* AND exotic*,"Pinus strobiformis (southwestern white pine) stand dynamics, regeneration, and disturbance ecology: A review ",0, http://search.ebscohost.com/login.aspx?direct=true&db=agr&AN=IND500602252&site=ehost-live ,828
5/22/2014,fire AND surrogat* AND exotic*,Post-fire management regimes affect carbon sequestration and storage in a Sierra Nevada mixed conifer forest ,0,http://search.ebscohost.com/login.aspx?direct=true&db=agr&AN=IND500633842&site=ehost-live ,828
5/22/2014,fire AND surrogat* AND exotic*,Post-fire regeneration across a fire severity gradient in the southern Cascades ,0,http://search.ebscohost.com/login.aspx?direct=true&db=agr&AN=IND500602239&site=ehost-live ,828
