Date,Search Title,Paper Title,Include (1) Exclude (0),PaperURL,# of Results
5/22/2014,fire AND surrogat* AND exotic*,Post?fire regeneration in alpine heathland: Does fire severity matter?,0,http://search.ebscohost.com/login.aspx?direct=true&db=agr&AN=IND500652994&site=ehost-live ,828
5/22/2014,fire AND surrogat* AND exotic*,"Potential effect of climate change on observed fire regimes in the Cordilleran forests of South-Central Interior, British Columbia ",0,http://search.ebscohost.com/login.aspx?direct=true&db=agr&AN=IND500623205&site=ehost-live ,828
5/22/2014,fire AND surrogat* AND exotic*,Pre- and post-fire pollutant loads in an urban fringe watershed in Southern California ,0, http://search.ebscohost.com/login.aspx?direct=true&db=agr&AN=IND500703159&site=ehost-live ,828
5/22/2014,fire AND surrogat* AND exotic*,Predicting time-windows for full recovery of postfire regenerating Pinus halepensis Mill. forests after a future wildfire ,0,http://search.ebscohost.com/login.aspx?direct=true&db=agr&AN=IND500718803&site=ehost-live ,828
5/22/2014,fire AND surrogat* AND exotic*,Preference of an exotic wood borer for stressed trees is more attributable to pre?alighting than post?alighting behaviour ,0,http://search.ebscohost.com/login.aspx?direct=true&db=agr&AN=IND500704089&site=ehost-live ,828
5/22/2014,fire AND surrogat* AND exotic*,Pre-wildfire management treatments interact with fire severity to have lasting effects on post-wildfire vegetation response ,0,http://search.ebscohost.com/login.aspx?direct=true&db=agr&AN=IND500650740&site=ehost-live ,828
5/22/2014,fire AND surrogat* AND exotic*,Projection of fire potential to future climate scenarios in the Alpine area: some methodological considerations ,0,http://search.ebscohost.com/login.aspx?direct=true&db=agr&AN=IND500679172&site=ehost-live ,828
5/22/2014,fire AND surrogat* AND exotic*,Propagule pressure as a driver of establishment success in deliberately introduced exotic species: fact or artefact?,0,http://search.ebscohost.com/login.aspx?direct=true&db=agr&AN=IND500670805&site=ehost-live ,828
5/22/2014,fire AND surrogat* AND exotic*,Recent Shrub Proliferation in the Mackenzie Delta Uplands and Microclimatic Implications ,0,http://search.ebscohost.com/login.aspx?direct=true&db=agr&AN=IND500624449&site=ehost-live ,828
5/22/2014,fire AND surrogat* AND exotic*,Recovery from topkill of shortleaf pineï¿? ©—ï¿? loblolly pine hybrids compared to their parent populations ,0,http://search.ebscohost.com/login.aspx?direct=true&db=agr&AN=IND500678820&site=ehost-live ,828
5/22/2014,fire AND surrogat* AND exotic*,Recovery of forest-floor vegetation after a wildfire in a Picea mariana forest ,0,http://search.ebscohost.com/login.aspx?direct=true&db=agr&AN=IND500708890&site=ehost-live,828
5/22/2014,fire AND surrogat* AND exotic*,Reduction of nutrient losses with eroded sediments by post-fire soil stabilisation techniques,0,http://search.ebscohost.com/login.aspx?direct=true&db=agr&AN=IND500680894&site=ehost-live ,828
5/22/2014,fire AND surrogat* AND exotic*,Regime shift on the roof of the world: Alpine meadows converting to shrublands in the southern Himalayas ,0,http://search.ebscohost.com/login.aspx?direct=true&db=agr&AN=IND500644773&site=ehost-live ,828
5/22/2014,fire AND surrogat* AND exotic*, Relationships between climate and macroscale area burned in the western United States,0,http://search.ebscohost.com/login.aspx?direct=true&db=agr&AN=IND500701209&site=ehost-live ,828
5/22/2014,fire AND surrogat* AND exotic*,"Relationships between climate, radial growth and wood properties of mature loblolly pine in Hawaii and a northern and southern site in the southeastern United States ",0,http://search.ebscohost.com/login.aspx?direct=true&db=agr&AN=IND500708463&site=ehost-live ,828
5/22/2014,fire AND surrogat* AND exotic*,Relationships between tree stand density and burn severity as measured by the Composite Burn Index following a ponderosa pine forest wildfire in the American Southwest ,0,http://search.ebscohost.com/login.aspx?direct=true&db=agr&AN=IND500667200&site=ehost-live ,828
5/22/2014,fire AND surrogat* AND exotic*,Response of brown-headed cowbirds and three host species to thinning treatments in low-elevation ponderosa pine forests along the northern Colorado Front Range ,0,http://search.ebscohost.com/login.aspx?direct=true&db=agr&AN=IND500692211&site=ehost-live ,828
5/22/2014,fire AND surrogat* AND exotic*,Response of Six?Lined Racerunner (Aspidoscelis sexlineata) to Habitat Restoration in Fire?Suppressed Longleaf Pine ,0,http://search.ebscohost.com/login.aspx?direct=true&db=agr&AN=IND500676432&site=ehost-live ,828
5/22/2014,fire AND surrogat* AND exotic*,Responses to invasion and invader removal differ between native and exotic plant groups in a coastal dune ,0,http://search.ebscohost.com/login.aspx?direct=true&db=agr&AN=IND500709550&site=ehost-live ,828
5/22/2014,fire AND surrogat* AND exotic*,Restoring Perennial Warm?Season Grasses as a Means of Reversing Mesophication of Oak Woodlands in Northern Mississippi ,0,http://search.ebscohost.com/login.aspx?direct=true&db=agr&AN=IND500649713&site=ehost-live ,828
5/22/2014,fire AND surrogat* AND exotic*,Restoring the sagebrush component in crested wheatgrass-dominated communites ,0,http://search.ebscohost.com/login.aspx?direct=true&db=agr&AN=IND500691634&site=ehost-live ,828
5/22/2014,fire AND surrogat* AND exotic*, Restoring Tropical Dry Forest Communities: Effects of Habitat Management and Outplantings onï¿? Composition and Structure,0,http://search.ebscohost.com/login.aspx?direct=true&db=agr&AN=IND500737815&site=ehost-live ,828
5/22/2014,fire AND surrogat* AND exotic*, Role of biotic interactions in regulating conifer invasion of grasslands ,0, http://search.ebscohost.com/login.aspx?direct=true&db=agr&AN=IND500605246&site=ehost-live ,828
5/22/2014,fire AND surrogat* AND exotic*,"Role of native and exotic mycorrhizal symbiosis to develop morphological, physiological and biochemical responses coping with water drought of date palm, Phoenix dactylifera ",0,http://search.ebscohost.com/login.aspx?direct=true&db=agr&AN=IND500721205&site=ehost-live ,828
5/22/2014,fire AND surrogat* AND exotic*,"Safety climate in the US federal wildland fire management community: influences of organisational, environmental, group and individual characteristics ",0,http://search.ebscohost.com/login.aspx?direct=true&db=agr&AN=IND500688492&site=ehost-live ,828
5/22/2014,fire AND surrogat* AND exotic*,Season of fire and nutrient enrichment affect plant community dynamics in subtropical semi-natural grasslands released from agriculture ,0,http://search.ebscohost.com/login.aspx?direct=true&db=agr&AN=IND500644787&site=ehost-live ,828
5/22/2014,fire AND surrogat* AND exotic*,Seasonal dynamics in understorey abundance and carbohydrate concentration in relation to browsing and bark stripping of Tasmanian Pinus radiata plantations,0,http://search.ebscohost.com/login.aspx?direct=true&db=agr&AN=IND500650731&site=ehost-live ,828
5/22/2014,fire AND surrogat* AND exotic*,Seasonal timing of inundation affects riparian plant growth and flowering: implications for riparian vegetation composition ,0,http://search.ebscohost.com/login.aspx?direct=true&db=agr&AN=IND500620758&site=ehost-live ,828
5/22/2014,fire AND surrogat* AND exotic*,Sediment and hydrological response to vegetation recovery following wildfire on hillslopes and the hollow of a small watershed ,0,http://search.ebscohost.com/login.aspx?direct=true&db=agr&AN=IND500685785&site=ehost-live ,828
5/22/2014,fire AND surrogat* AND exotic*,Seed abscission schedules and the timing of post-fire salvage of Picea mariana and Pinus banksiana ,0,http://search.ebscohost.com/login.aspx?direct=true&db=agr&AN=IND500673008&site=ehost-live ,828
5/22/2014,fire AND surrogat* AND exotic*,Selective thinning of Arbutus unedo coppices following fire: Effects on growth at the individual and plot level ,0,http://search.ebscohost.com/login.aspx?direct=true&db=agr&AN=IND500627237&site=ehost-live ,828
5/22/2014,fire AND surrogat* AND exotic*,Simple plant traits explain functional group diversity decline in novel grassland communities of Texas ,0,http://search.ebscohost.com/login.aspx?direct=true&db=agr&AN=IND500629922&site=ehost-live ,828
5/22/2014,fire AND surrogat* AND exotic*,Small-scale patch structure in North American and South African grasslands responds differently to fire and grazing ,0,http://search.ebscohost.com/login.aspx?direct=true&db=agr&AN=IND500680383&site=ehost-live ,828
5/22/2014,fire AND surrogat* AND exotic*,Smoke plume height measurement of prescribed burns in the south-eastern United States ,0,http://search.ebscohost.com/login.aspx?direct=true&db=agr&AN=IND500636177&site=ehost-live ,828
5/22/2014,fire AND surrogat* AND exotic*,Snag Benchmarks and Treatment Options for?Mixed?Pine Forest Restoration in Eastern Upper Michigan ,0,http://search.ebscohost.com/login.aspx?direct=true&db=agr&AN=IND500689893&site=ehost-live ,828
5/22/2014,fire AND surrogat* AND exotic*,Snag longevity and surface fuel accumulation following post-fire logging in a ponderosa pine dominated forest ,0,http://search.ebscohost.com/login.aspx?direct=true&db=agr&AN=IND500602240&site=ehost-live ,828
5/22/2014,fire AND surrogat* AND exotic*,Soil development in vegetation patches of Pinus ponderosa forests: Interface with restoration thinning and carbon storage,0,http://search.ebscohost.com/login.aspx?direct=true&db=agr&AN=IND500708445&site=ehost-live ,828
5/22/2014,fire AND surrogat* AND exotic*,"Spatial, seasonal, and diel forest floor moisture dynamics in Jeffrey pine-white fir forests of the Lake Tahoe Basin, USA ",0,http://search.ebscohost.com/login.aspx?direct=true&db=agr&AN=IND500683148&site=ehost-live ,828
5/22/2014,fire AND surrogat* AND exotic*,"Stand development, fire and growth of old-growth and young forests in southwestern Oregon, USA",0, http://search.ebscohost.com/login.aspx?direct=true&db=agr&AN=IND500633868&site=ehost-live ,828
5/22/2014,fire AND surrogat* AND exotic*,Stand water use status in relation to fire in a mixed species eucalypt forest ,0,http://search.ebscohost.com/login.aspx?direct=true&db=agr&AN=IND500684442&site=ehost-live ,828
5/22/2014,fire AND surrogat* AND exotic*,Strengthening Invasion Filters to Reassemble Native Plant Communities: Soil Resources and Phenological Overlap,0,http://search.ebscohost.com/login.aspx?direct=true&db=agr&AN=IND500656589&site=ehost-live ,828
5/22/2014,fire AND surrogat* AND exotic*,Structure and phylogenetic diversity of post-fire ectomycorrhizal communities of maritime pine ,0,http://search.ebscohost.com/login.aspx?direct=true&db=agr&AN=IND500721889&site=ehost-live ,828
5/22/2014,fire AND surrogat* AND exotic*,Susceptibility of eastern US habitats to invasion of Celastrus orbiculatus (oriental bittersweet) following fire ,0,http://search.ebscohost.com/login.aspx?direct=true&db=agr&AN=IND500667201&site=ehost-live ,828
5/22/2014,fire AND surrogat* AND exotic*,Synergy between Glomus fasciculatum and a beneficial Pseudomonas in reducing root diseases and improving yield and forskolin content in Coleus forskohlii Briq. under organic field conditions ,0,http://search.ebscohost.com/login.aspx?direct=true&db=agr&AN=IND500618852&site=ehost-live ,828
5/22/2014,fire AND surrogat* AND exotic*,Temperature and functional traits influence differences in nitrogen uptake capacity between native and invasive grasses ,0,http://search.ebscohost.com/login.aspx?direct=true&db=agr&AN=IND500619531&site=ehost-live,828
5/22/2014,fire AND surrogat* AND exotic*,Temporal and vertical drosophilid (Insecta; Diptera) assemblage fluctuations in a neotropical gallery forest,0,http://search.ebscohost.com/login.aspx?direct=true&db=agr&AN=IND500634780&site=ehost-live ,828
5/22/2014,fire AND surrogat* AND exotic*,"The dynamics of three shrub species in a fire-prone temperate savanna: the interplay between the seed bank, seed rain and fire regime ",0,http://search.ebscohost.com/login.aspx?direct=true&db=agr&AN=IND500620757&site=ehost-live ,828
5/22/2014,fire AND surrogat* AND exotic*,The global fire–productivity relationship,0,http://search.ebscohost.com/login.aspx?direct=true&db=agr&AN=IND500719447&site=ehost-live ,828
5/22/2014,fire AND surrogat* AND exotic*,The impact of an invasive plant changes over time ,0,http://search.ebscohost.com/login.aspx?direct=true&db=agr&AN=IND500721834&site=ehost-live ,828
5/22/2014,fire AND surrogat* AND exotic*,The impact of tropospheric ozone on landscape-level merchantable biomass and ecosystem carbon in Canadian forests ,0,http://search.ebscohost.com/login.aspx?direct=true&db=agr&AN=IND500618235&site=ehost-live ,828
5/22/2014,fire AND surrogat* AND exotic*,"The importance of affect, perceived risk and perceived benefit in understanding support for fuels management among wildland–urban interface residents ",0,http://search.ebscohost.com/login.aspx?direct=true&db=agr&AN=IND500663588&site=ehost-live ,828
5/22/2014,fire AND surrogat* AND exotic*,The influence of fuel moisture content on the combustion of Eucalyptus foliage,0,http://search.ebscohost.com/login.aspx?direct=true&db=agr&AN=IND500663593&site=ehost-live ,828
5/22/2014,fire AND surrogat* AND exotic*,"The propagule supply, litter layers and canopy shade in the littoral community influence the establishment and growth of Myriophyllum aquaticum ",0,http://search.ebscohost.com/login.aspx?direct=true&db=agr&AN=IND500612596&site=ehost-live ,828
5/22/2014,fire AND surrogat* AND exotic*,"The relationship of large fire occurrence with drought and fire danger indices in the western USA, 1984–2008: the role of temporal scale ",0,http://search.ebscohost.com/login.aspx?direct=true&db=agr&AN=IND500701204&site=ehost-live ,828
5/22/2014,fire AND surrogat* AND exotic*, The role of fire in structuring trait variability in Neotropical savannas,0,http://search.ebscohost.com/login.aspx?direct=true&db=agr&AN=IND500623135&site=ehost-live ,828
5/22/2014,fire AND surrogat* AND exotic*,The role of holm oak edges in the control of disturbance and conservation of plant diversity in fire-prone landscapes ,0,http://search.ebscohost.com/login.aspx?direct=true&db=agr&AN=IND500650736&site=ehost-live ,828
5/22/2014,fire AND surrogat* AND exotic*,There goes the neighborhood: apparent competition between invasive and native orchids mediated by a specialist florivorous weevil ,0,http://search.ebscohost.com/login.aspx?direct=true&db=agr&AN=IND500618246&site=ehost-live ,828
5/22/2014,fire AND surrogat* AND exotic*,Toxicity of forest fire retardant chemicals to stream?type chinook salmon undergoing parr–smolt transformation ,0,http://search.ebscohost.com/login.aspx?direct=true&db=agr&AN=IND500646451&site=ehost-live ,828
5/22/2014,fire AND surrogat* AND exotic*,Trophic consequences of a biological invasion: do plant invasions increase predator abundance?,0,http://search.ebscohost.com/login.aspx?direct=true&db=agr&AN=IND500643545&site=ehost-live ,828
5/22/2014,fire AND surrogat* AND exotic*,Tropical paradox: a multi-scale analysis of the invasion paradox within Miami Rock Ridge tropical hardwood hammocks ,0,http://search.ebscohost.com/login.aspx?direct=true&db=agr&AN=IND500638579&site=ehost-live ,828
5/22/2014,fire AND surrogat* AND exotic*,"Understory plant community responses to hazardous fuels reduction treatments in pinyon-juniper woodlands of Arizona, USA ",0,http://search.ebscohost.com/login.aspx?direct=true&db=agr&AN=IND500605282&site=ehost-live ,828
5/22/2014,fire AND surrogat* AND exotic*, Upward expansion of fire?adapted grasses along a warming tropical elevation gradient ,0,http://search.ebscohost.com/login.aspx?direct=true&db=agr&AN=IND500656574&site=ehost-live ,828
5/22/2014,fire AND surrogat* AND exotic*,Using livestock to manage plant composition: A meta-analysis of grazing in California Mediterranean grasslands,3,http://search.ebscohost.com/login.aspx?direct=true&db=agr&AN=IND500606074&site=ehost-live ,828
5/22/2014,fire AND surrogat* AND exotic*,Using native annual plants to restore post-fire habitats in western North America ,0,http://search.ebscohost.com/login.aspx?direct=true&db=agr&AN=IND500688480&site=ehost-live ,828
5/22/2014,fire AND surrogat* AND exotic*," Variability of historical forest structure and fire across ponderosa pine landscapes of the Coconino Plateau and south rim of Grand Canyon National Park, Arizona, USA ",0,http://search.ebscohost.com/login.aspx?direct=true&db=agr&AN=IND500628536&site=ehost-live,828
5/22/2014,fire AND surrogat* AND exotic*,"Variability of warm/dry mixed conifer forests in southwestern Colorado, USA: Implications for ecological restoration ",0,http://search.ebscohost.com/login.aspx?direct=true&db=agr&AN=IND500684444&site=ehost-live ,828
5/22/2014,fire AND surrogat* AND exotic*,"Visualizing mega-fires of the past: A case study of the 1894 Hinckley Fire, east-central Minnesota, USA ",0,http://search.ebscohost.com/login.aspx?direct=true&db=agr&AN=IND500642326&site=ehost-live ,828
5/22/2014,fire AND surrogat* AND exotic*,Why are aggregates destroyed in low intensity fire?,0,http://search.ebscohost.com/login.aspx?direct=true&db=agr&AN=IND500642326&site=ehost-live ,828
5/22/2014,fire AND surrogat* AND exotic*,Wildfire and forest harvest disturbances in the boreal forest leave different long-lasting spatial signatures ,0,http://search.ebscohost.com/login.aspx?direct=true&db=agr&AN=IND500629859&site=ehost-live ,828
5/22/2014,fire AND surrogat* AND exotic*,Wildfire and fuel treatment effects on forest carbon dynamics in the western United States,0,http://search.ebscohost.com/login.aspx?direct=true&db=agr&AN=IND500673011&site=ehost-live ,828
5/22/2014,fire AND surrogat* AND exotic*,Wildfire effects on vadose zone hydrology in forested boreal peatland microforms,0,http://search.ebscohost.com/login.aspx?direct=true&db=agr&AN=IND500642441&site=ehost-live ,828
5/22/2014,fire AND surrogat* AND exotic*,Wildfire hazard mapping: exploring site conditions in eastern US wildland–urban interfaces,0,http://search.ebscohost.com/login.aspx?direct=true&db=agr&AN=IND500680898&site=ehost-live ,828
5/22/2014,fire AND surrogat* AND exotic*,"Wildfire ignition-distribution modelling: a comparative study in the Huron–Manistee National Forest, Michigan, USA ",0,http://search.ebscohost.com/login.aspx?direct=true&db=agr&AN=IND500636184&site=ehost-live ,828
5/22/2014,fire AND surrogat* AND exotic*,Wildland fire ash and particulate distribution in adjacent residential areas,0,http://search.ebscohost.com/login.aspx?direct=true&db=agr&AN=IND500710979&site=ehost-live ,828
5/22/2014,fire AND surrogat* AND exotic*,Young jack pine and high severity fire combine to create potentially expansive areas of understocked forest ,0,http://search.ebscohost.com/login.aspx?direct=true&db=agr&AN=IND500708432&site=ehost-live ,828
5/22/2014,fire AND surrogat* AND invasive*,A comparison of Canadian and Russian boreal forest fire regimes,0,http://search.ebscohost.com/login.aspx?direct=true&db=agr&AN=IND500642339&site=ehost-live ,1281
5/22/2014,fire AND surrogat* AND invasive*,A comparison of targeted and systematic fire-scar sampling for estimating historical fire frequency in south-western ponderosa pine forests ,0,http://search.ebscohost.com/login.aspx?direct=true&db=agr&AN=IND500710989&site=ehost-live ,1281
5/22/2014,fire AND surrogat* AND invasive*,A hybrid of the invasive plant Sphagneticola trilobata has similar competitive ability but different response to nitrogen deposition compared to parent ,0,http://search.ebscohost.com/login.aspx?direct=true&db=agr&AN=IND500740666&site=ehost-live ,1281
5/22/2014,fire AND surrogat* AND invasive*,Aboveground and Belowground Impacts Following Removal of the Invasive Species Baby's Breath (Gypsophila paniculata) on Lake Michigan Sand Dunes ,0,http://search.ebscohost.com/login.aspx?direct=true&db=agr&AN=IND500676439&site=ehost-live ,1281
5/22/2014,fire AND surrogat* AND invasive*,"Abundance and dispersion of the invasive Mediterranean annual, Centaurea melitensis in its native and non-native ranges ",0,http://search.ebscohost.com/login.aspx?direct=true&db=agr&AN=IND500632570&site=ehost-live ,1281
5/22/2014,fire AND surrogat* AND invasive*,Assessing resilience and state-transition models with historical records of cheatgrass Bromus tectorum invasion in North American sagebrush-steppe ,0,http://search.ebscohost.com/login.aspx?direct=true&db=agr&AN=IND500706227&site=ehost-live ,1281
5/22/2014,fire AND surrogat* AND invasive*, Biogeographic comparisons of the traits and abundance of an invasive crab throughout its native and invasive ranges ,0,http://search.ebscohost.com/login.aspx?direct=true&db=agr&AN=IND500675823&site=ehost-live ,1281
5/22/2014,fire AND surrogat* AND invasive*,"Canopy fuel characteristics in relation to crown fire potential in pine stands: analysis, modelling and classification ",0,http://search.ebscohost.com/login.aspx?direct=true&db=agr&AN=IND500635868&site=ehost-live ,1281
5/22/2014,fire AND surrogat* AND invasive*,Climate and exotic pasture area in landscape determines invasion of forest fragments by two invasive grasses ,0,http://search.ebscohost.com/login.aspx?direct=true&db=agr&AN=IND500721101&site=ehost-live ,1281
5/22/2014,fire AND surrogat* AND invasive*,Cold tolerance of the invasive Carcinus maenas in the east Pacific: molecular mechanisms and implications for range expansion in a changing climate ,0,http://search.ebscohost.com/login.aspx?direct=true&db=agr&AN=IND500694312&site=ehost-live ,1281
5/22/2014,fire AND surrogat* AND invasive*,Comparative phylogeography of invasive Rattus rattus and Rattus norvegicus in the U.S. reveals distinct colonization histories and dispersal ,0,http://search.ebscohost.com/login.aspx?direct=true&db=agr&AN=IND500646687&site=ehost-live ,1281
5/22/2014,fire AND surrogat* AND invasive*,Comparison of phototrophic shell-degrading endoliths in invasive and native populations of the intertidal mussel Mytilus galloprovincialis ,0,http://search.ebscohost.com/login.aspx?direct=true&db=agr&AN=IND500663131&site=ehost-live ,1281
5/22/2014,fire AND surrogat* AND invasive*,"Comparison of short term low, moderate, and high severity fire impacts to aquatic and terrestrial ecosystem components of a southern USA mixed pine/hardwood forest ",0,http://search.ebscohost.com/login.aspx?direct=true&db=agr&AN=IND500708497&site=ehost-live ,1281
5/22/2014,fire AND surrogat* AND invasive*,Competitive dominance of the invasive plant Impatiens glandulifera: using competitive effect and response with a vigorous neighbour ,0,http://search.ebscohost.com/login.aspx?direct=true&db=agr&AN=IND500714462&site=ehost-live ,1281
5/22/2014,fire AND surrogat* AND invasive*,Connectivity and invasive species management: towards an integrated landscape approach,0,http://search.ebscohost.com/login.aspx?direct=true&db=agr&AN=IND500694300&site=ehost-live ,1281
5/22/2014,fire AND surrogat* AND invasive*,Contingent absences account for range limits but not the local abundance structure of an invasive springtail ,0,http://search.ebscohost.com/login.aspx?direct=true&db=agr&AN=IND500647201&site=ehost-live ,1281
5/22/2014,fire AND surrogat* AND invasive*, Contrasting levels of evolutionary potential in populations of the invasive plant Polygonum cespitosum ,0,http://search.ebscohost.com/login.aspx?direct=true&db=agr&AN=IND500718450&site=ehost-live ,1281
5/22/2014,fire AND surrogat* AND invasive*,Current mismatch between research and conservation efforts: The need to study co-occurring invasive plant species ,0,http://search.ebscohost.com/login.aspx?direct=true&db=agr&AN=IND500660368&site=ehost-live ,1281
5/22/2014,fire AND surrogat* AND invasive*,Decoupling litter barrier and soil moisture influences on the establishment of an invasive grass ,0,http://search.ebscohost.com/login.aspx?direct=true&db=agr&AN=IND500668080&site=ehost-live ,1281
5/22/2014,fire AND surrogat* AND invasive*,Demographic responses of the invasive annual grass Microstegium vimineum to prescribed fires and herbicide ,0,http://search.ebscohost.com/login.aspx?direct=true&db=agr&AN=IND500696472&site=ehost-live ,1281
5/22/2014,fire AND surrogat* AND invasive*,Distribution models of invasive plants over-estimate potential impact ,0,http://search.ebscohost.com/login.aspx?direct=true&db=agr&AN=IND500670790&site=ehost-live ,1281
5/22/2014,fire AND surrogat* AND invasive*,Do invasive species perform better in their new ranges?,0,http://search.ebscohost.com/login.aspx?direct=true&db=agr&AN=IND500717295&site=ehost-live ,1281
5/22/2014,fire AND surrogat* AND invasive*,Does time since introduction influence enemy release of an invasive weed?,0,http://search.ebscohost.com/login.aspx?direct=true&db=agr&AN=IND500695510&site=ehost-live ,1281
5/22/2014,fire AND surrogat* AND invasive*,Ecological impacts of the invasive grass Sorghum halepense on native tallgrass prairie ,0,http://search.ebscohost.com/login.aspx?direct=true&db=agr&AN=IND500618252&site=ehost-live ,1281
5/22/2014,fire AND surrogat* AND invasive*,Econometric analysis of fire suppression production functions for large wildland fires ,0,http://search.ebscohost.com/login.aspx?direct=true&db=agr&AN=IND500636180&site=ehost-live ,1281
5/22/2014,fire AND surrogat* AND invasive*,Effects of experimental climate warming and associated soil drought on the competition between three highly invasive West European alien plant species and native counterparts,0,http://search.ebscohost.com/login.aspx?direct=true&db=agr&AN=IND500629923&site=ehost-live ,1281
5/22/2014,fire AND surrogat* AND invasive*,Effects of fire severity on early recovery of Patagonian steppes ,0,http://search.ebscohost.com/login.aspx?direct=true&db=agr&AN=IND500710986&site=ehost-live ,1281
